season,episode,scene,character,line
4,11,2,Light Hope,"Adora has made much progress, but she still has not succeeded in balancing Etheria. If the planet is not balanced, the Heart of Etheria cannot be accessed."
4,11,2,Glimmer,"Balance the planet... What does that mean? And, how do I do that?"
4,11,2,Light Hope,There is only one piece still missing. The princesses are conduits for the Heart's power. They must all be connected to their Runestones for the Heart of Etheria to function.
4,11,2,Glimmer,And that will make us stronger?
4,11,2,Light Hope,It will give you power like you've never known. The final piece is a princess who has not yet accepted her destiny...
4,11,3,Light Hope,A princess robbed of her power by the Horde's meddling.
4,12,0,Shadow Weaver,Please keep your bot out of my flower beds.
4,12,0,Scorpia,"Oh! Oh, sorry about that."
4,12,0,Scorpia,"Emily! Emily, come here!"
4,12,0,Scorpia,No! Not in the skull plant things!
4,12,0,Scorpia,"So uh, they let you have your own garden here? Aren't you a prisoner? Am I prisoner? Everyone's been so nice. How come we're not, you know, in a prison? Is this garden a prison?"
4,12,0,Shadow Weaver,"It wasn't, until today.
Scorpia: Oh! Heh, heh! Right, right, sorry!"
4,12,0,Scorpia,I-I'm not even here! Just a garden away..
4,12,0,Scorpia,"Emily! What did I just say? I said, stay out of the skull plants!"
4,12,0,Scorpia,"Bad bot! Bad! I said, drop it!"
4,12,1,Glimmer,Scorpia!
4,12,1,Shadow Weaver,"Your majesty, you're back. Did you find what you were looking for?"
4,12,1,Glimmer,"Yes. Light Hope told me everything I need to know, and I have a plan."
4,12,1,Shadow Weaver,"A plan? Excellent, we should discuss-"
4,12,1,Glimmer,"Scorpia, I need your help."
4,12,1,Scorpia,Me?
4,12,1,Glimmer,You're the only person who can save Etheria. We need you to reconnect to the Black Garnet.
4,12,1,Shadow Weaver,"What? Your majesty, I don't understand. We should reconvene with the other princesses and-"
4,12,1,Glimmer,The other princesses are gone. But it's fine!
4,12,1,Shadow Weaver,Gone?
4,12,1,Glimmer,I said it's fine. I have a plan-
4,12,1,Scorpia,Gone where?
4,12,1,Glimmer,"Okay, would anyone else like to interrupt me?"
4,12,1,Other,"I'm sorry your majesty, but Double Trouble has escaped."
4,12,3,Entrapta,"Wow, I can't believe we're all here on Beast Island at the same time. What an incredible coincidence."
4,12,3,Bow,Uh... It's not a coincidence. We came to find you.
4,12,3,Entrapta,"Beast Island Log, tide cycle 37. I have confirmed that the outside world still exists. I founded princesses! Well, one princess, some sort of horse bird-hybrid, Bow, and..."
4,12,3,Entrapta,I don't know you.
4,12,3,Micah,Yes you do. You stole my food.
4,12,3,Entrapta,Oh yeah! It was delicious!
4,12,3,Entrapta,Wasn't there another one of you?
4,12,3,Bow,Yes. Glimmer. You know her. And she's... not here.
4,12,3,Swift Wind,Can we talk about how I'm not a bird?
4,12,3,Adora,"Entrapta, we have been looking all over on this island for you. Are you ok?"
4,12,3,Entrapta,"Of course I'm ok! Have you seen this place? An Island, full of technological monstrosities, each more deadly than the next? Its paradise!"
4,12,3,Bow,"Yeah, um, glad you're having fun, but we're kind of here to rescue you?"
4,12,3,Entrapta,Rescue me? Did I not just rescue you?
4,12,3,Adora,Yeah.. that didn't go as planned.
4,12,3,Bow,"We came to bring you back. We would've come sooner, but we had no idea you were here. We though you were still with Hordak."
4,12,3,Bow,Scorpia told us what happened. She and the other princesses are waiting for you at Bright Moon.
4,12,3,Adora,"Entrapta, please. We need your help. We discovered what the First Ones and what they were doing to Etheria, a terrible secret that no one else knows."
4,12,3,Entrapta,You mean The Heart of Etheria? Why didn't you just say so?
4,12,4,Lonnie,Sorry. We didn't know you were in here. We'll just come back later.
4,12,4,Catra,Wait.
4,12,4,Catra,What's the report from the field?
4,12,4,Lonnie,"We just got back from conquering another rebel town! The third one this week. So, you're welcome."
4,12,4,Kyle,"Ah, you should've seen us! I was all:"
4,12,4,Kyle,"And then Rogelio, he was all:"
4,12,4,Catra,Watch it!
4,12,4,Lonnie,Calm down Catra! It's not like Scorpia needs it anymore.
4,12,4,Catra,You don't get to talk to me like that. I'm your commander. Got it?
4,12,4,Lonnie,What is wrong with you? We're winning! Even you should be happy.
4,12,4,Catra,Happy?
4,12,4,Catra,I'll be happy when the Rebellion and She-Ra are gone for good! But that's never going to happen with the three of you goofing off all the time. You are pathetic!
4,12,4,Kyle,Stay away from her!
4,12,4,Kyle,We used to be your friends. Why are you treating us like this?
4,12,4,Catra,Get out!
4,12,4,Double Trouble,Ouch! It's worse than I thought. You're a mess.
4,12,4,Catra,"Double Trouble? Y-You came back? I mean, where were you? I thought um-"
4,12,4,Double Trouble,You thought I left you?
4,12,4,Double Trouble,"Apologies for the delay, Kitten. I got held up in Bright Moon. But don't worry, I brought something that might cheer you up."
4,12,4,Catra,Better be something good after all that.
4,12,4,Double Trouble,"The time to strike the final blow to the Rebellion is upon us. The princesses aren't getting along, and most deliciously, She-Ra is gone."
4,12,4,Double Trouble,So..
4,12,4,Catra,Bright Moon is unprotected.
4,12,4,Double Trouble,Told you it would cheer you up.
4,12,5,Shadow Weaver,We must find Double Trouble at once. They know too much! We can't let them return to the Fright Zone!
4,12,5,Glimmer,Forget Double Trouble. They don't matter anymore. The only person we need is right here.
4,12,5,Shadow Weaver,Scorpia is not a true princess. She has never shown any connection to her Runestone.
4,12,5,Glimmer,"But she will, as soon as we get her to the Black Garnet."
4,12,5,Shadow Weaver,"Get her to the Black Garnet? Your majesty, you're not thinking this through. You cannot go to the Fright Zone now! You are without allies, without your prisoner, and without a plan!"
4,12,5,Glimmer,I have a plan!
4,12,5,Shadow Weaver,"My queen, listen to me. Think. Have I not only tried to help you?"
4,12,5,Shadow Weaver,You are letting your emotions get the better of you. This plan is too risky. What would your mother say if she were here?
4,12,5,Glimmer,"You don't get to talk to me about my mother. Besides. You, were the one who told me to decide what kind of queen I am. And I've decided. I'm the queen who's going to save Etheria."
4,12,5,Shadow Weaver,My queen.
4,12,6,Hordak,What is the meaning of this?
4,12,6,Catra,"Oh sorry, I though you wanted to defeat the Rebellion. Because this is what that looks like."
4,12,6,Hordak,We are already spread thin from occupying so much territory.
4,12,6,Catra,"We're occupying plenty. But not Bright Moon. Not yet. Double Trouble reported in. The princesses are in chaos, She-Ra is gone, and without their precious hero to protect the castle, well.."
4,12,6,Hordak,we can strike the final blow to the Rebellion. When Bright Moon falls we will control all of Etheria.
4,12,6,Catra,Big brothers going to be so impressed.
4,12,6,Hordak,"Yes. This will show him what I am capable of. What we are capable of. Good work, Catra."
4,12,6,Hordak,Victory is ours.
4,12,7,Swift Wind,"I don't like it here. The signal, it's getting louder again. I think we should go."
4,12,7,Micah,The talking horse is right. We should stay away. No one ever comes back from this part of the island.
4,12,7,Entrapta,"Don't worry about the signal, it's better inside."
4,12,7,Bow,Inside where?
4,12,7,Bow,Wha-
4,12,7,Entrapta,Somewhere...
4,12,7,Entrapta,A-ha! Ta da!
4,12,7,Entrapta,Come on! You're going to love it.
4,12,7,Swift Wind,"Wow, this place is terrible. I hate it."
4,12,7,Adora,It's a First Ones Temple.
4,12,7,Entrapta,"Isn't it amazing? The First Ones tried to their secrets by dumping them on Beast Island! The answers I've been looking for, they're all here!"
4,12,7,Entrapta,"My theories were correct. I knew the First Ones had retrofitted the planet with tech, I just didn't know why. But it all makes sense now! They were mining the planet's magic, using it to power their weapon, The Heart of Etheria!"
4,12,7,Entrapta,"But of course you know all about The Heart of Etheria already, seeing as you're apart of it."
4,12,7,Adora,"Wait, wait. Hang on. What?"
4,12,7,Entrapta,"All the princesses are. Hang on, I'll show you."
4,12,7,Entrapta,"The Heart draws its power from the magic of the princesses. It needs all their Runestones engaged to work. And She-Ra is the most important piece, the key! She channels the weapon's power and focuses it."
4,12,7,Entrapta,She-Ra is the only being strong enough to withstand the destructive energy of The Heart.
4,12,7,Entrapta,"So the First Ones made the sword to control her, to use her."
4,12,7,Entrapta,"When The Heart is deployed, She-Ra will raise her sword and fire it!"
4,12,7,Adora,"She-Ra is the key.. That means I can stop it, right? If She-Ra fires the weapon, then I just won't do it."
4,12,7,Adora,"Please, Entrapta, tell me I can stop it!"
4,12,7,Entrapta,"Once the planet is balanced, no one can stop it. Not even the First Ones could control it. That's why they left. When the weapon is activated it will channel all its power into you. You don't get to refuse."
4,12,7,Bow,But Etheria isn't balanced yet. Look! There's still one Runestone offline. We might still have a chance. Wait.
4,12,7,Bow,The Black Garnet. Scorpia.
4,12,7,Adora,Scorpia's with the Rebellion. You don't think Glimmer would-?
4,12,7,Bow,There's no way she would know Scorpia's the final piece. Right?
4,12,7,Adora,We have to get back to Bright Moon.
4,12,8,Glimmer,Scorpia! We need to go to the Black Garnet chamber now. My plan is going to work!
4,12,8,Glimmer,What's wrong? I thought you would want to be a princess?
4,12,8,Scorpia,"Ok. I have been considering, I really appreciate the offer, but, I only came here to help Entrapta. I left the Horde, but I'm not gonna betray them. Or Catra."
4,12,8,Glimmer,"This will save them. Horde Prime could be here at any moment. If he shows up and we're not ready to defend ourselves, everyone loses. Do you really think he'll need to keep Catra around?"
4,12,8,Glimmer,We both want to save the people we love. But I can't do it without you.
4,12,8,Scorpia,It's hopeless.. What if the Black Garnet doesn't want me? I just.. kind of get rejected a lot.
4,12,8,Glimmer,"Tell me about it. My best friends left me. Even before this, I was the weak princess, the one who had to recharge. Who didn't fit. But that's changed now. We've changed now. We're stronger than anyone knows. We can do this. We can save everyone."
4,12,8,Scorpia,Everyone?
4,12,8,Glimmer,You're not hopeless. You were born for this. And I'll help you. We're in this together. You're going to make a great princess.
4,12,8,Scorpia,"Sorry, that was probably too much. Oh wow still going."
4,12,8,Scorpia,I'm in. So what now?
4,12,8,Glimmer,"Now, we go to save the world."
4,12,9,Micah,"What's going on, is Glimmer in danger?"
4,12,9,Bow,She might be. We have to get back as soon as we can.
4,12,9,Micah,"We're going home now? That's great! Wait, should I bring something back for Glimmer? What does she like? Does she like bugs?"
4,12,9,Swift Wind,"Oh, Micah. No one likes bug."
4,12,9,Entrapta,Have a good trip. Come again soon!
4,12,9,Adora,"Entrapta, no. You're coming with us."
4,12,9,Entrapta,"This place.. It's pure information. Everything I've ever dreamed of knowing about the planet, it's all here. So I'm staying."
4,12,9,Adora,No. We're not going to leave you.
4,12,9,Swift Wind,"Oh, this is not good."
4,12,9,Entrapta,Everything back there with the princesses and then... with Hordak.. was so.. confusing. I just wasn't suited for friendship. I belong here.
4,12,9,Bow,"Entrapta, please! Fight it!"
4,12,9,Adora,For the honor of Grayskull!
4,12,9,Adora,Head for the ship!
4,12,9,Micah,This way!
4,12,9,Entrapta,Just leave me!
4,12,9,Bow,"Entrapta, no! The island is affecting you. You can't give in!"
4,12,9,Entrapta,"You don't understand, that's okay... no one understands me... I tried to be a good friend. But I didn't understand that either."
4,12,9,Bow,What? Did you think friendship was easy? It takes work to be there for other people! It takes everything you've got.
4,12,9,Entrapta,Everyone leaves me behind... why should it be any different now?
4,12,9,Bow,"Because we're not ever going to leave you behind again! And we never gave up on you, even when you were with the Horde! Because that's what friends do."
4,12,9,Entrapta,You haven't... given up on me?
4,12,9,Adora,We're out of time!
4,12,9,Adora,"Entrapta, we flew here on an ancient First Ones ship. Do you want to see it or not?"
4,12,9,Entrapta,A ship? You have a First Ones spacecraft? A First Ones spacecraft that works??
4,12,9,Entrapta,I WANNA SEE!
4,12,9,Swift Wind,"Uh, hate to interrupt, but there's more monsters coming.. Like a lot more!"
4,12,9,Bow,Did anything I said about friendship work for you? Or was it all the ship?
4,12,9,Entrapta,"Oh definitely the ship. But, thank you. I'm-I'm glad we're friends."
4,12,9,Adora,"Guys, we really have to go!"
4,12,9,Swift Wind,To the ship!
4,12,9,Entrapta,"Get em' girl! I'll be back for you, I promise!"
4,12,10,Adora,You got me!
4,12,10,Double Trouble,"Ugh. I know, I know. No one is welcome in Hordak's super-secret sanctum."
4,12,10,Double Trouble,Not since you let that princess in.
4,12,10,Double Trouble,"What makes something a sanctum, anyway?"
4,12,10,Double Trouble,No small talk? I thought I'd at least get a pat on the back for my daring escape.
4,12,10,Double Trouble,"It's too bad, though."
4,12,10,Double Trouble,"I was looking forward to meeting this Entrapta character before I left Bright Moon. But of course, as you know, she wasn't there."
4,12,10,Hordak,What did you say?
4,12,10,Double Trouble,"Oh, you don't need keep up the charade with me. I figured out the truth. You had Catra send Entrapta to Beast Island, so She-Ra would run off to rescue her. A brilliant idea! The perfect distraction. I have to applaud your work, you really had me going. So scorned by Entrapta's betrayal. ...Even now you look like you had no idea!"
4,12,10,Double Trouble,"Brava. I mean, I did consider the alternative... That Catra's been lying to you this whole time."
4,12,10,Double Trouble,"That she made you think she was your partner in crime, while really she is the one who betrayed you .."
4,12,10,Double Trouble,"But between you and me, there's no way she's that good of an actor."
4,12,10,Double Trouble,"Well, I'll leave you to it. Congrats again. Great work all around."
4,12,11,Entrapta,Hellooo! It's the most beautiful thing I've ever seen! How does it work?? What does this button do? I'm going to push it and find out!
4,12,11,Bow,Mm. Take us home to Bright Moon.
4,12,11,Micah,Huh? This is actually real?
4,12,11,Bow,Um.. Yes. Remember we did the pinching thing already?
4,12,11,Micah,"Well, still, I couldn't let myself believe... Is it all true?"
4,12,11,Micah,We're really going home? And this horse really talks?
4,12,12,Double Trouble,Too easy.. As usual.
4,12,13,Glimmer,Are you ready?
4,12,13,Scorpia,Not really.
4,12,13,Micah,Bright Moon. I'm really home.
4,12,13,Micah,"Glimmer! Glimmer, where are you?"
4,12,13,Shadow Weaver,She's gone.
4,12,13,Shadow Weaver,Micah? Is it really you?
4,12,13,Micah,What is this traitor doing here?
4,12,13,Adora,Where's Glimmer?
4,12,14,Catra,Hordak? You wanted to talk with me?
4,12,14,Catra,"Come on, I don't have time for this. Our troops are moving out for Bright Moon as we speak. If there's something you need, you can-"
4,12,14,Hordak,"Hello, Force Captain."
4,13,0,Adora,"Stay here, King Micah. The Sorcerers Guild is on their way to help protect Bright Moon. I promise, Your Majesty, we'll bring Glimmer home to you. Swift Wind, take Bow and Entrapta to the Fright Zone. Find Glimmer, we can still stop this."
4,13,0,Bow,What are you going to do?
4,13,0,Adora,I'm going to the Crystal Castle. I have to keep Light Hope from activating the Heart of Etheria. For the honor of Grayskull.
4,13,0,Scorpia,"Don't worry. I'm an expert on sneaking around this place. I'll get us to the Black Garnet Chamber, super stealthy-like, and no one will be the--"
4,13,0,Lonnie,What are you doing here?
4,13,0,Scorpia,"Oh, hey, guys, hey. Have you met our newest recruit here? Glimmax. Glimmax Pinkhairton."
4,13,0,Lonnie,"Scorpia, we thought you got out. If Catra sees you--"
4,13,0,Scorpia,"She can't. I know how this looks, but I promise, I'm here to help."
4,13,0,Lonnie,"We're done protecting Catra. We're done with this whole place. But you're one of us, Scorpia. We won't stand in your way."
4,13,0,Scorpia,"Oh. You guys, get in here."
4,13,0,Glimmer,"I'd get out of here, if I were you."
4,13,0,Lonnie,"That's the plan. But hey, take care of her."
4,13,0,Scorpia,Should be easy from here. Seems like a pretty slow day in the Fright Zone.
4,13,0,Catra,"Hordak, whatever you're doing--"
4,13,0,Hordak,I know about Entrapta.
4,13,0,Catra,Entrapta was a traitor. What else is there to know?
4,13,0,Hordak,"I trusted you. Your days were numbered the moment you crossed me. And after I'm through, you can't even begin to imagine the punishments Horde Prime will inflict upon you."
4,13,0,Catra,"Oh, because he's going to swoop down and fix everything for you at any moment, right? You're lying to yourself now."
4,13,0,Catra,"Why would Horde Prime care about you? You're a defect, a mistake. Haven't you noticed? I'm running things here. Now we can finally end this. I didn't need Entrapta. I didn't need Adora, or Scorpia. And I don't need you."
4,13,0,Hordak,Huh?
4,13,0,Scorpia,"Huh. I don't remember it looking like this. But it has been a while. Hey, there. Princess Scorpia, we're supposed to, like, connect? I'm no princess. Not really."
4,13,0,Glimmer,"Hey, we're in this together. You're one of us, and we believe in you."
4,13,0,Scorpia,Whoa. It's like--
4,13,0,Glimmer,Connection.
4,13,0,Light Hope,Planet balanced. Full functionality restored.
4,13,0,Adora,"Oh, no."
4,13,0,Double Trouble,"Hey, Catra."
4,13,0,Catra,No. You can't do this. You can't come in and take this from me now.
4,13,0,Double Trouble,"Whoa, I knew this would get a rise out of you, but, still, you really are obsessed, aren't you, kitten?"
4,13,0,Double Trouble,"You know, it took me a while, but I finally figured out your character."
4,13,0,Double Trouble,"You try so hard to play the big, bad villain, but your heart's never been in it, has it?"
4,13,0,Catra,What--? What are you? Stop. Stop it.
4,13,0,Double Trouble,"People have hurt you, haven't they?"
4,13,0,Double Trouble,They didn't believe in you.
4,13,0,Double Trouble,They didn't trust you.
4,13,0,Double Trouble,Didn't need you. Left you.
4,13,0,Double Trouble,But did you ever stop to think maybe they're not the problem?
4,13,0,Double Trouble,"It's you. You drive them away, wildcat."
4,13,0,Catra,Why are you doing this?
4,13,0,Double Trouble,"It's for your own good, darling. We both know this was never what you really wanted. But it was also a good distraction. Your army was ambushed on their way to defenseless Bright Moon. Your face right now is almost better than applause. Almost."
4,13,0,Catra,You betrayed me.
4,13,0,Double Trouble,"It's not personal, darling. You knew how this worked. The best way to survive is always choose the winning side. The Rebels have some kind of ancient superweapon. Any minute now, they're going to use it, and when they do...everything you've worked for will be destroyed. I'd really better be going before that happens. And scene."
4,13,0,Scorpia,"Wow. Oh, sorry. Boy, that sure has a kick, doesn't it?"
4,13,0,Glimmer,You're amazing.
4,13,0,Scorpia,"Thank you. It's terrifying. And fun? It's ""terrifun-fying."""
4,13,0,Glimmer,Go help the other princesses finish the fight. I'm going to find Hordak and Catra.
4,13,0,Scorpia,"Catra. I know she's done a lot of bad things, but...don't hurt her."
4,13,0,Glimmer,"We're the good guys, remember?"
4,13,0,Adora,"Light Hope, please, don't do this."
4,13,0,Light Hope,"Good, you are here. Now we can begin. After a thousand years, my programming will be fulfilled. The Heart of Etheria will be unleashed against the First Ones' enemies."
4,13,0,Adora,"No, there are no First Ones anymore. Whatever war they were fighting, it's long over."
4,13,0,Light Hope,The First Ones will rise again. You are a descendant of their mighty empire. That is why I used all my strength to reach across the entire universe to find you and bring you here.
4,13,0,Adora,You told me Hordak was the one who brought me through the portal. You told me he stole me. But it was you all along. All of this is because of you.
4,13,0,Light Hope,This is your intended function. You will bring the First Ones to glory. It is what you were born to do.
4,13,0,Adora,"No. No, I won't."
4,13,0,Light Hope,The Heart of Etheria has been activated. You will be the one to fire it. There is no stopping it now.
4,13,0,Glimmer,Guess you wanted all my attention for yourself. Your troops are gone. You're all alone. You've lost.
4,13,0,Catra,"What are you waiting for? Do it. Looks like we're both alone, Sparkles."
4,13,0,Scorpia,"I'm coming, little buddy. No."
4,13,0,Adora,It won't work. Mara hid us in Despondos so you couldn't hurt anyone else.
4,13,0,Light Hope,"Mara...Mara's interference caused a significant delay. But no longer. With the planet balanced, portal capability is restored. Initiate planetary move, out of the Dimension of Despondos."
4,13,0,Bow,Swift Wind. Are you okay?
4,13,0,Swift Wind,I don't know. It's too much.
4,13,0,Bow,"What the...? Entrapta, what's happening?"
4,13,0,Entrapta,"It's a portal. A big portal. With the plant balanced, the portal capabilities must be back online. We're getting pulled through."
4,13,0,Bow,Through to where?
4,13,0,Entrapta,It's...
4,13,0,Bow,Stars.
4,13,0,Entrapta,We're not in Despondos anymore. We're in the wider universe.
4,13,0,Bow,I need to find Glimmer.
4,13,0,Glimmer,Adora was right. Light Hope used me. She activated the Heart.
4,13,0,Catra,So? I thought you wanted to win. Use your weapon.
4,13,0,Glimmer,I can't. It would destroy everything. I have to try and stop it.
4,13,0,Light Hope,The Heart is primed and ready. Commencing activation.
4,13,0,Adora,"Look at all these stars, these worlds. They will all be destroyed. Mara sacrificed her life to stop this from happening."
4,13,0,Light Hope,Mara. Mara would not want me to-- Mara was a traitor. She turned against her people.
4,13,0,Adora,"Mara was your friend. She knew you were more than just a program, and so do I. You can stop this."
4,13,0,Light Hope,I am not as strong as Mara. I cannot change my programming. This is our destiny.
4,13,0,Adora,No. This is not my destiny.
4,13,0,Light Hope,You will comply.
4,13,0,Adora,"No, no, no."
4,13,0,Light Hope,It is time.
4,13,0,Adora,I won't be controlled. I am not a piece of their machine. I am not a weapon. And I'm going to end this now.
4,13,0,Light Hope,No. Stop. Don't. Do it. Do it. Don't. Don't. Do it.
4,13,0,Light Hope,Adora? Thank you.
4,13,0,Glimmer,Bow.
4,13,0,Bow,"Stay there, I'm coming."
4,13,0,Hordak,"Horde Prime, he's here."
4,13,0,Bow,No!
4,13,0,Horde Prime,"Is that you, little brother? I thought you had perished."
4,13,0,Hordak,I was pulled into a shadow dimension. All this time I have been trying to return to your side. But it has not been in vain. I have built an empire in your name.
4,13,0,Horde Prime,"I received your transmission, but I could not determine its source. Until I detected an energy reading like nothing I have ever seen before. And when I arrived, this curious planet had appeared."
4,13,0,Hordak,"I conquered this world for you. To show you that I am worthy, so that I may retake my place by your side. I have bent its people to my will."
4,13,0,Horde Prime,"To your will. Why can I not see your thoughts? I see now. You have given yourself a name. You tried to create an empire of your own. There was even a time you wished I would not come for you, is that so?"
4,13,0,Hordak,"No, brother. I did it, all of it, for you."
4,13,0,Horde Prime,"You have forgotten who you are. You truly think you are worthy to stand beside me, could be equal to me? I made you in my image, but you have become an abomination. And so, you must be reborn."
4,13,0,Horde Prime,"Take him to be reconditioned. But I have been rude. We have a guest. Royalty, unless I'm mistaken. I apologize for my little brother. His actions are an embarrassment. I desire only peace and order."
4,13,0,Glimmer,Then you'll leave us alone?
4,13,0,Horde Prime,"Oh, no, child. I cannot let words spread of my brother's botched conquest. For order to thrive, this whole mess must be wiped away. Beginning with you."
4,13,0,Catra,"I wouldn't do that if I were you. You don't wanna destroy Etheria. The whole planet is some kind of ancient superweapon. A really, really big one. Sparkle, here, is a part of it. And if you wanna learn how to use it, you need me."
4,13,0,Horde Prime,"A weapon? That explains these readings. They are stronger than anything I've seen. Your Majesty, what an honor to host a guest of your stature. Trust that your planet will become the jewel of my empire, and it will allow me to bring peace and order to the farthest reaches of the universe. Thank you for your allegiance, child. All creatures, no matter how small, have a place in service of Horde Prime."
4,13,0,Bow,Adora. They took her. They took Glimmer.
4,13,0,Adora,She-Ra's gone. The Sword is broken.
4,13,0,Bow,So what are we gonna do?
4,13,0,Adora,We're going to get Glimmer back...and we're going to save the universe.
5,1,0,Adora,For Etheria!
5,1,0,Bow,Two down.
5,1,0,Swift Wind,And a whole Galactic Horde to go.
5,1,0,Mermista,"I'll get the next one, I guess."
5,1,0,Adora,"It's okay, you can come out now."
5,1,0,Adora,Run!
5,1,0,Mermista,My turn.
