season,episode,scene,character,line
3,5,7,Adora,I don't know what's happening to me. It's like I'm losing my mind.
3,5,7,Catra,You just need to relax.
3,5,7,Adora,"Yeah… Yeah, you're probably right. I'm--I'm fine. Everything's fine."
3,5,7,Catra,"Of course I'm right. Everything's perfect. Soon, the two of us are gonna be ruling Etheria together, just like we always planned."
3,5,7,Adora,Is that what you really want? To rule the world?
3,5,7,Catra,"I—I mean, yeah, obviously… Isn't that what you want, too?"
3,5,7,Adora,I don't know.
3,5,7,Catra,Don't flake out on me now. This is what we always wanted. Everything will be perfect as long as we stay together.
3,5,7,Adora,What if we don't stay together? What if it all goes wrong?
3,5,7,Adora,Why can't you see that?!
3,5,7,Catra,"Adora! Stay with me, okay? You're just seeing things. It's all in your head."
3,5,7,Lonnie,Adora! Catra! Thought we'd find you up there. Get down here! We got big news.
3,5,7,Adora,…What?
3,5,7,Lonnie,"Okay, okay. We just got word, we're being sent to Salineas tonight."
3,5,7,Adora,But they said at the briefing that's not for another week.
3,5,7,Lonnie,Adora? It's been a week.
3,5,7,Adora,No.
3,5,7,Catra,Adora?
3,5,7,Adora,"I know this is wrong, can't you see it?! My memories don't match, we're jumping around, things are disappearing, it's like time and space aren't working right. And I—"
3,5,7,Catra,"Adora, stop it. Stop!"
3,5,7,Adora,Mara! Portal. I think I remember. None of this is right. We're not supposed to be here.
3,5,7,Catra,Adora! Everything's okay.
3,5,7,Adora,"Stop saying that! This isn't right! Everyone keeps telling me everything is perfect, but it's not. …Everyone except Scorpia."
3,5,7,Catra,"Adora! Adora, where are you going?"
3,5,8,Adora,You don't think things are perfect!
3,5,8,Scorpia,"Whoa! Ever hear of personal space? I happen to take it very seriously. And also, …what are you talking about?"
3,5,8,Adora,"Things aren't right! You must feel it, too. I'm not sure why yet, but I'm starting to remember. …I need to get into Hordak's sanctum and you need to help me!"
3,5,8,Scorpia,"Hordak's sanctum. I'm not sure if you know, but no one is allowed in there without express permission. I mean, this is basic stuff. Are you sure you're qualified to be a Force Captain?"
3,5,8,Adora,"All of my memories stop in Hordak's sanctum. There's something in there…something powerful and dangerous, and that's where it all started. That's where I have to go to fix things!"
3,5,8,Scorpia,"Okay, Adora, I totally hear you. Everything's gonna be fine. In fact, I think I know some nice people who can help if you just—"
3,5,8,Adora,"Scorpia, you have to remember something. Tell me you remember. Everyone's acting like things are perfect, except for you… Even Catra is—"
3,5,8,Scorpia,Catra…
3,5,8,Adora,You do remember…
3,5,8,Scorpia,"No, I— I mean, I-I don't know. And Catra she—she was just scared, she didn't mean to—What is going on? I keep-I keep forgetting things. This… This is all wrong. How did we get here?"
3,5,8,Adora,I don't know. All I know is that we have to get to Hordak's sanctum.
3,5,9,Scorpia,HOW DID WE GET HERE?
3,5,9,Adora,"Just go with it, okay? We need to get past those guards."
3,5,9,Scorpia,"Oh, man, this is a bad plan! What happens if we get caught? We are so fired!"
3,5,9,Scorpia,"Enough, stop it. Don't, just—just move, move."
3,5,9,Other,Hey! What are you doing here? Hands up!
3,5,9,Scorpia,Did I just do that?! I am so fired.
3,5,9,Adora,Scorpia. You need to focus. None of that matters.
3,5,9,Scorpia,I don't like this.
3,5,9,Scorpia,"Uh, wasn't there a door here just a second ago?"
3,5,9,Adora,"Things are disappearing. It's getting worse. We have to hurry, there's-there's gotta be another way in. …There! It's that lady!"
3,5,9,Scorpia,What lady?
3,5,9,Adora,The one who says “Mara.” Come on!
3,5,9,Scorpia,"Okay, that makes no sense! But I'm gonna follow you because I don't see a lot of other options."
3,5,10,Adora,Wait!
3,5,10,Scorpia,"Oh, she's so fast. …Okay."
3,5,10,Scorpia,Why… is everyone… so… fast? Whoa.
3,5,10,Adora,This is it. Come on.
3,5,10,Scorpia,I hope this works.
3,5,10,Adora,It will. And then you can go back to hating me.
3,5,10,Scorpia,"Look. If you get us out of this, I promise I won't hate you. I will just dislike you a reasonable amount."
3,5,10,Adora,Deal.
3,5,10,Adora,"No. No, no…"
3,5,10,Adora,"This can't be right. It was here, it was right here. Where is it?!"
3,5,10,Adora,"Catra. It was Catra. Catra did this, she captured me, she took-- …the sword. She activated the portal."
3,5,10,Scorpia,Sword?
3,5,10,Adora,"The sword. There's supposed to be a sword. My sword. But it's gone. It's in the portal! That's why we're here, I need to find it!"
3,5,10,Scorpia,"Quick, hide!"
3,5,10,Scorpia,That was close.
3,5,10,Adora,Run!
3,5,10,Scorpia,"What is happening?! I don't understand what is going on! Adora, wait! Wait up!"
3,5,10,Adora,Scorpia? Scorpia!
3,5,11,Adora,Wait!
3,5,11,Razz,"Why, hello, Mara, dearie!"
3,5,11,Adora,Who are you? Why do I know you? What are you doing in the Fright Zone? Is this real?
3,5,11,Razz,"I am afraid so, dearie. But you can still fix it. There's still time!"
3,5,11,Razz,"Find me in the woods, dearie!"
3,5,11,Lonnie,"Adora! Adora, where have you been?!"
3,5,11,Adora,"Lonnie, we have to get out of here. Where are Kyle and Rogelio?"
3,5,11,Lonnie,Who?
3,5,11,Adora,Our…teammates since we were kids. Where are they?
3,5,11,Lonnie,Uh…I don't remember… I think… I think they're gone? What is going on?!
3,5,11,Adora,Come on!
3,5,12,Adora,"Lonnie, we have to…"
3,5,12,Adora,Catra!
3,5,12,Catra,Adora—
3,5,12,Catra,"Hey! You've officially lost it, haven't you?!"
3,5,12,Adora,"Listen, we have to go. Now! Scorpia, Lonnie, Kyle, Rogelio, they're all gone."
3,5,12,Catra,What are you talking about? Who's gone?
3,5,12,Adora,They're gone! There's nothing left. And we'll be next if we don't get out of here right now.
3,5,12,Catra,"You're not making any sense. Everything's fine, okay? It's--"
3,5,12,Adora,"Don't say it's perfect! I know it's not perfect, and so do you!"
3,5,12,Catra,You've gone crazy. I'm not going anywhere.
3,5,12,Adora,Catra…
3,5,12,Catra,What are you--?!
3,5,13,Adora,"Catra, no!"
3,5,13,Adora,"Catra, you can't. We need to get as far from the Fright Zone as possible or we'll be completely erased along with everything else."
3,5,13,Catra,You think you can convince me by kidnapping me?! What is wrong with you?
3,5,13,Adora,I won't leave you behind again.
3,5,13,Catra,Why can't you just stay? We have everything we ever wanted.
3,5,13,Adora,"It's not real, Catra. As much as I wish that things could be simple the way they used to be, there's no going back."
3,5,13,Adora,Why did you do it?
3,5,13,Catra,I don't know what you're talking about!
3,5,13,Adora,There's no time. We have to go.
3,5,13,Adora,You look out for me and I look out for you. Nothing really bad can happen as long as we have each other.
3,5,13,Catra,You promise?
3,5,13,Adora,I-
3,5,13,Adora,I promise. Everything will be okay if we just stay together.
3,5,13,Adora,Come with me. You don't have to go back there. We can fix this.
3,5,13,Adora,Help me fix this. Please!
3,5,13,Adora,This can't be what you wanted!
3,5,13,Catra,Don't you get it?! I am never going to go with you!
3,5,13,Catra,"You always have to go and ruin it, don't you?"
3,5,13,Adora,"Catra, look what's happening! You're going to destroy everything!"
3,5,13,Catra,I don't care. I won't let you win. I'd rather see the whole world end than let that happen.
3,5,13,Adora,"Catra, no!"
3,5,13,Adora,Catra!
3,5,14,Razz,"Oh, is that you, Mara? You made it after all."
3,5,14,Adora,Madame Razz.
3,5,14,Razz,"It's been such a long time since we last saw each other, hasn't it? That or…it hasn't happened yet. I always get those two things mixed up."
3,5,14,Adora,I couldn't save anyone else.
3,5,14,Razz,"It's not too late. You can still bring them back, but you must act quickly."
3,5,14,Adora,How do you know all of this?!
3,5,14,Razz,"Because this has all happened before! I remember it like it was yesterday. For Madame Razz, it was yesterday…"
3,5,14,Adora,This happened before…with Mara!
3,5,14,Razz,"Yes, dearie. When she moved Etheria and took away the stars. Heh, it was crazy."
3,5,14,Adora,It's all my fault. I've been so afraid of becoming another Mara. Destroying the world the way she did…and now…it's happening.
3,5,14,Razz,"Destroy the world? No. Mara saved the world, and so will you. But you can't waste any more time. You need to go back to the beginning. You need to find the sword. That is the only way this will stop!"
3,5,14,Adora,"I did that, didn't I? I went back to the Fright Zone. The portal wasn't there!"
3,5,14,Razz,"No, that wasn't the beginning. You need to go back to the very beginning."
3,5,14,Adora,I-I-I don't understand.
3,5,14,Razz,"That's all right, dearie. You don't need to understand. You just need to remember."
3,5,14,Adora,I have to remember…
3,5,14,Adora,Bow and Glimmer. I need to find them!
3,5,14,Razz,"Go on, dearie! Quickly!"
3,6,0,Glimmer,Woohoo!
3,6,0,Glimmer,"That was awesome, Can we do it one more time?"
3,6,0,Angella,"Oh, that's quite enough for today, Besides-"
3,6,1,Micah,Did you two go flying without me?
3,6,1,Glimmer,Dad. You're back!
3,6,1,Micah,Think fast!
3,6,1,Micah,You're getting good at that.
3,6,1,Glimmer,I've been practicing
3,6,1,Angella,"Yes, She only blew up my flower garden twice."
3,6,1,Angella,Welcome home love.
3,6,1,Micah,"You were having so much fun without me, you cant of missed me much."
3,6,1,Other,Your majesties!
3,6,1,Other,We found a girl sneaking into bright moon through the whispering woods. She was trying to break into the princess's chambers.
3,6,1,Angella,What? Please escort the princess safely to her room until we determine the trespassers intentions.
3,6,1,Adora,Glimmer!
3,6,3,Bow,Glimmer! What is going on? Everyones really freaked out today!
3,6,3,Glimmer,Theres a trespasser in Bright moon! We need to figure out who she is!
3,6,3,Bow,Why do we need to figure out who she is?
3,6,3,Glimmer,"Because... I don't know! I just feel like I know her somehow! So, we're gonna and spy while my parents interrogate her!"
3,6,3,Bow,What?!
3,6,3,Glimmer,"I know it sounds crazy, but she came here for a reason and I need to know why. If you want to stay behind, just tell me."
3,6,3,Bow,I want to stay behind..
3,6,3,Glimmer,"Hmm, Didn't hear anything, Lets go!"
3,6,3,Angella,Bring in the prisoner!
3,6,3,Adora,"King Micah?! You're here? Oh, You look different then your mural."
3,6,3,Micah,"This is a truth spell, You will be compelled to answer honestly. Now tell us, who are you and why did you break into Bright moon?"
3,6,3,Adora,"Uh, Ok, wow, This is gonna be a lot to explain, um- and its going to sound a little weird but I swear its all true. Reality is collapsing in on itself because of the portal that Hordak and Catra set off. They're from the horde, Except you don't remember the horde because the fright zone disappeared Like right now, It was pretty crazy. It got eraised by the portal but I promise it used to exist and we were fighting them with the Princess Alliance."
3,6,3,Adora,And I had a sword that could turn me into an 8 foot tall warrior lady with really great hair called She-ra
3,6,3,Adora,But the horde used the sword to set off the portal and I need Glimmer and Bow to help me stop it and save Etheria!
3,6,3,Micah,i-.. Uh.
3,6,3,Angella,Who are you?! How do you know my daughter and the royal apprentice historian?
3,6,3,Adora,"Hes a historian here? That doesn't matter, we're best friends."
3,6,3,Micah,I've never seen you before..
3,6,3,Adora,"Well thats cause normally, you're dead"
3,6,3,Other,Are you threatening the king?!
3,6,3,Angella,How dare you say such a thing!
3,6,3,Adora,"I'm sorry but none of this is right. You must have noticed it! What did you do yesterday, theres a reason you can't remember. This world isn't real!"
3,6,3,Angella,I have heard quite enough!
3,6,3,Micah,"Angella, Its alright."
3,6,3,Adora,I need to talk to Bow and Glimmer! They're the strongest people I know!
3,6,3,Adora,I need their help to stop reality falling apart!
3,6,3,Micah,"Guards, escort this young woman to our holding cell!"
3,6,3,Micah,The spare room.
3,6,3,Adora,Wait! You have to believe me!
3,6,3,Micah,"Don't listen to her, she's lying."
3,6,3,Angella,But your truth spell...
3,6,3,Micah,I must of done it wrong... Theres no way anything she said could be true. It's- It's not possible!
3,6,4,Adora,Bow! Glimmer! I knew you guys would-
3,6,4,Adora,Do you remember me at all?
3,6,4,Glimmer,"Listen crazy lady! My dad has never messed up a spell, you were telling the truth in there, How can that be?"
3,6,4,Adora,"Of course you were listening in, I should've known."
3,6,4,Bow,Ok will you stop acting like you know us?! We've never met you!
3,6,4,Adora,Yes you have.
3,6,4,Adora,"Bow, You saved our lives more times then I can count. You're a great fighter, a genius inventer, and you shouldn't worry about what your dads think. They're proud of you, just like I am."
3,6,4,Adora,And Glimmer-
3,6,4,Adora,"You never give up or admit defeat, I know making friends is hard for you yet your the one who pulled us all together."
3,6,4,Adora,I've never met anyone like you.
3,6,4,Glimmer,"None of that is true! I'm just a princess, and Bow isn't a fighter, He's.. Bow."
3,6,4,Bow,"This-.. This isn't right.. I mean, everything is perfect. Everyone keeps saying everything's perfect."
3,6,4,Glimmer,My dad... He's gone isn't he?
3,6,4,Adora,yes..
3,6,4,Bow,Woah!
3,6,4,Bow,"Uh, what is that?"
3,6,4,Adora,"Oh no, It's starting to happen here too. We don't have much time."
3,6,4,Glimmer,"So, what do we do now?"
3,6,4,Adora,"We fix reality, uh, somehow.. Razz told me to go back to the beginning. But, I don't know what that means."
3,6,4,Bow,"Ok well, You said a portal started all of this, Can you think of anyone who'd know how to make a-"
3,6,4,Bow,Entrapta...
3,6,4,Adora,Of course! Entrapta
3,6,4,Adora,Glimmer! Can you teleport us to Dryl?
3,6,4,Glimmer,What? I barely managed to teleport me and Bow in here!
3,6,4,Adora,then we'll just have to do this the Best Friends Squad way!
3,6,5,Adora,Run! Go. Go. Go!
3,6,5,Glimmer,This is how we normally do things?!
3,6,5,Adora,"Yeah, We improvise!"
3,6,5,Bow,I really don't like improvising!
3,6,5,Adora,"Ok, we have to get out of Bright moon before it disappears like the Fright zone!"
3,6,5,Other,"Princess, you shouldn't be-"
3,6,5,Other,Is that the prisoner?!
3,6,5,Glimmer,Sorry!
3,6,5,Glimmer,There was a door here!
3,6,5,Bow,"Uh, Guys!?"
3,6,5,Angella,Step away from my daughter! Now!
3,6,5,Glimmer,Mum stop! Can't you see what happening?
3,6,5,Micah,Angie?
3,6,5,Micah,Whats wrong?
3,6,5,Glimmer,"I'm sorry, For everything. But we have to make this right"
3,6,5,Angella,Glimmer!
3,6,5,Entrapta,Hello!
3,6,5,Entrapta,Do I know you?
3,6,6,Micah,Angie?
3,6,6,Micah,"We'll get her back, Angie, and then everything will be perfect again."
3,6,6,Angella,"This is perfect my love, but it's not real."
3,6,6,Angella,I remember now...
3,6,6,Angella,"I miss you so much... But Glimmer needs my help, and I can't stay with nothing but memories."
3,6,6,Micah,Angella I-... I-
3,6,6,Angella,Goodbye Micah.
3,6,6,Micah,"Angie, Angella wait! I'm not-"
3,6,7,Entrapta,This is facinating! I've never had non-robots visit me before! Usually it's just me and all my friends.
3,6,7,Adora,Friends?
3,6,7,Entrapta,Aren't they amazing!?
3,6,7,Entrapta,"And if they break, I can just make new friends!"
3,6,7,Entrapta,Tiny snacks?
3,6,7,Entrapta,"Oh, sorry about that. They're still getting the hang of human food. Unless this is what you eat! I have so many questions, Tell me everything!"
3,6,7,Adora,"Entrapta, I know what i'm about to say sounds crazy-"
3,6,7,Entrapta,Is this about the unstable portal slowly consuming and warping our reality?
3,6,7,Adora,"Now you're not gonna believe- Wait, What did you just say?"
3,6,7,Entrapta,"Oh, I figured it out a while ago. An unstable portal is the only thing that would account for all the anomalies I've been picking up in my research. The portal exists somewhere in our world and as long as it's still open it's gonna keep to destablising reality, making things disappear faster and faster until, Bam! Nothing's left!"
3,6,7,Entrapta,Which is a bad thing...
3,6,7,Adora,How do we stop it?
3,6,7,Entrapta,Portals are gateways..
3,6,7,Entrapta,"Wormholes that connect one area of space to another, The only way to turn it off is from the inside. But, who ever shuts down the portal can't leave. they'll be trapped between realities, possibly forever."
3,6,7,Entrapta,Oh! Imagine the data they could collect!
3,6,7,Glimmer,"Wait, so whoever turns it off will be trapped inside it forever?"
3,6,7,Entrapta,Exactly.
3,6,7,Adora,"There must be another way! Try to remember Entrapta, when you and Hordak built the portal machine-"
3,6,7,Entrapta,"Remember...I.. remember, I had a lab partner, Hordak, we were friends and then Catra... Oh, I remember everything now...I'm not really here."
3,6,7,Adora,"No, No this can't be happening already. We should of had more time!"
3,6,7,Entrapta,"There is no more time, It all makes sense now, it's your sword, the portal is centred on you! It's following you!"
3,6,7,Adora,What?
3,6,7,Adora,No!
3,6,7,Entrapta,"You need to remove the sword from the inside, It's powering the portal"
3,6,7,Entrapta,As soon as it's gone everything will be alright again! {sadly] It was nice being friends with you..
3,6,7,Adora,"Entrapta, No!"
3,6,8,Glimmer,Where are we?
3,6,8,Adora,We're at the beacon. Stars?
3,6,8,Glimmer,"Adora, what is happening?"
3,6,8,Adora,It's what Entrapta said. Reality is unraveling faster now. I – I think we might be too late. Mara? Stay here. Entrapta said the portal is centered on me. You're at risk as long as we're together. If I draw it away –
3,6,8,Glimmer,"No. I know what you're thinking, Adora. You said you knew us? Well, we know you."
3,6,8,Bow,You can't relax to save your life. You're terrible at acting.
3,6,8,Glimmer,"You're stubborn and headstrong, and you're our best friend."
3,6,8,Adora,"Wait, no."
3,6,8,Glimmer,"You got this, Adora. We believe in you."
3,6,8,Catra,"Hey, Adora."
3,6,9,Catra,Oh... Where are your friends?
3,6,9,Adora,"Catra, stop. You have to--"
3,6,9,Catra,"It's always the same with you, Adora. “I have to do this. Oh, we have to do that.” Let's be honest, all of this is your fault."
3,6,10,Catra,"If you hadn't gotten captured, your sword wouldn't have opened the portal. If you hadn't gotten the sword and been the world's worst She-Ra, none of this would've happened."
3,6,11,Catra,"Admit it, Adora, the world would still be standing if you had never come through that portal in the first place."
3,6,12,Catra,You made me this. You took everything from me.
3,6,13,Catra,"You broke the world, and it is all your fault."
3,6,13,Adora,"No, it's not."
3,6,14,Adora,"I didn't make you pull the switch. I didn't make you do anything. I didn't break the world, but I am gonna fix it. And you? You  made your choice. Now live with it."
3,6,14,Angella,Adora!
3,6,14,Angella,Hold on!
3,6,14,Angella,"I remember, Adora. I know this world isn't our own. How do we fix this?"
3,6,14,Adora,Go back to the beginning. Razz meant my beginning. The the place I came through as a baby. I can fix everything. I just need to go into the portal and pull out the sword. That'll turn it off and everyone will come back safe and sound.
3,6,14,Angella,"And you'll come back safe, too? Adora, you'll come back, too, right?"
3,6,14,Adora,I have to do this. This is my destiny.
3,6,14,Angella,"Oh, Adora, no. This is not it."
3,6,14,Adora,But... this is the only way to fix things.
3,6,14,Angella,Do you want to know a secret? I am a coward.
3,6,14,Adora,What? No.
3,6,14,Angella,"I've always been the queen who stays behind. Micah was the brave one. And then Glimmer... Oh, Glimmer. So much like her father. And once again I stayed behind, letting her make the hard choices, letting her be brave for me. I told myself I was being responsible, but, Adora, I was just scared. And then I met you. You inspired us. You inspired me. Not because it was your destiny, but because you never let fear stop you. And now I choose to be brave."
3,6,14,Adora,No! Your Majesty! Angella!
3,6,14,Angella,Take care of each other.
3,6,14,Adora,For the honor of Grayskull!
3,6,15,Catra,Huh?
3,6,15,Catra,We have to go now.
3,6,15,Glimmer,Adora.
3,6,15,Bow,Adora.
3,6,15,Glimmer,"See? We told you, you could do it."
3,6,15,Frosta,"Woo-hoo! Yes, we did it. We did it."
3,6,15,Shadow Weaver,"Touching as this is, we need to go. Now!"
3,6,15,Other,laugh and shout
3,6,15,Bow,We did it. Did we do it? We did it.
3,6,15,Glimmer,"I'm probably going to be grounded for the rest of my life, but reality is back to normal. Speaking of which, I guess I should go find my mom. Maybe she'll be so happy to see me that she'll forget about grounding me. Adora? What is it?"
3,6,15,Adora,"Angella, she stayed behind. She – She –"
3,6,15,Adora,She saved us.
3,6,16,Horde Prime,"So, that's where you've been, little brother."
4,1,0,Castaspella,"Glimmer, come at once. We need you in the War Room right away! There's no time to waste. You must make a decision."
4,1,0,Adora,We're here for you.
4,1,0,Glimmer,That one!
4,1,0,Castaspella,"The Future Queen has spoken. At Glimmer's coronation, we will be serving – ice cream cake!"
4,1,0,Glimmer,People are starting to arrive. I can't believe this is really my coronation day. Me. Queen Glimmer. Ugh. It sounds so weird.
4,1,0,Bow,"Queen Glimmer. Queen Glimmer. Queen Glimmer! Yeah, that's going to take some getting used to."
4,1,0,Glimmer,I just... never thought it would actually happen.
4,1,0,Adora,Hey don't worry. You've got me and Bow beside you all the way. We'll make sure this day is perfect.
4,1,0,Glimmer,"Yeah, you're right. We've got this. Do I look okay?"
4,1,0,Adora,Like a queen.
4,1,0,Castaspella,Here you all are! What are you standing around for? The guests are starting to arrive! Come on! There's so much to do!
4,1,0,Adora,I'm worried about Glimmer.
4,1,0,Bow,"Must be hard celebrating with
Angella being gone."
4,1,0,Adora,"It's her coronation. This should
be a perfect day for Glimmer. We'll make it perfect. All we have to
do is keep her mind off –"
4,1,0,Bow,Angella?
4,1,0,Adora,"Off everything, yes. Now come
on!"
4,1,0,Castaspella,"So, the ceremony begins
with the Ritual Quest, followed by your first speech as queen and
most importantly, the whole thing ends with a Grand Ball!"
4,1,0,Adora,"Oh, there's a quest!
We're great at quests."
4,1,0,Castaspella,"Yes, the Quest of Queens,
in which Glimmer will forge her connection to the Moonstone. The
Moonstone's power has been balanced between you and your mother since
you were born, but now, with her... her absent..."
4,1,0,Bow,"So, about that quest! We're great
at quests, right guys?"
4,1,0,Castaspella,"Yes, it's all in the
scrolls. Secret ritual, witnesses, light, etcetera, etcetera."
4,1,0,Castaspella,"Oh, and you'll need this. Are those the flower arrangements? Glimmer, what do you
think?"
4,1,0,Glimmer,"Oh, uh, they're, uh, fine?"
4,1,0,Castaspella,"You're right, they're
awful! Burn them at once. Also, you're fired."
4,1,0,Glimmer,"Aunt Casta, you don't ..."
4,1,0,Castaspella,"Don't you worry about a
thing. In addition to being a powerful sorceress, I am also a
legendary party-planner. This will be a coronation for the ages! 
Glimmer, take us to the terrace!"
4,1,0,Castaspella,"Oh, we're-- We're walking,
are we? Great. We can use the exercise."
4,1,0,Frosta,"What do you think? I wanted to
do something special for you."
4,1,0,Glimmer,This is going to be awful.
4,1,0,Frosta,"Awful inspiring, right? I can
make more!"
4,1,0,Glimmer,"I appreciate the idea. But I
need someone for a very important job to, uh, greet the guests."
4,1,0,Frosta,"Oh, you need a bouncer! I'm on
it! Bouncer!"
4,1,0,Glimmer,"Wait, I didn't say bouncer.
Okay."
4,1,0,Castaspella,"Glimmer! I need your
opinion on color schemes."
4,1,0,Glimmer,Uh...blue? What about purple?
4,1,0,Castaspella,"Excellent choice. Isn't
this fun? Soon you will have to make many decisions, just like your
mother... That is, uh-- Chop, chop, everyone! Adora, move the ice
sculpture to the side! We still need flower arrangements! Where is
that florist?"
4,1,0,Glimmer,You fired him.
4,1,0,Castaspella,"Oh, right. Perhaps you'd
like to do the flowers, Glimmer?"
4,1,0,Glimmer,Uhhh
4,1,0,Bow,Hmm.
4,1,0,Glimmer,"you know, I bet Mermista would
love to do the flowers! Right Mermista?"
4,1,0,Mermista,"Wow, how did you know? Flower
arranging is my passion."
4,1,0,Castaspella,"Ah! Wonderful! Now let's
talk stem length."
4,1,0,Perfuma,What? No! Why?
4,1,0,Swift Wind,"Is now a good time to talk
about my song for the coronation? I will require a stage, and oats
for the backup horses."
4,1,0,Frosta,"Stop bothering Glimmer!
Bouncer!"
4,1,0,Adora,"Hey! I think it's all really
coming together, don't you?"
4,1,0,Adora,"yep, it's gonna be perfect! What
else we need to do, Bow?"
4,1,0,Bow,"Still don't know what the lantern
is for! This is all so official and confusing. And it says Glimmer
needs to wear some ceremonial robe. But I don't know where to get
that!"
4,1,0,Glimmer,"Maybe if we all looked
together--"
4,1,0,Adora,Don't worry! We will find it!
4,1,0,Glimmer,But –
4,1,0,Adora,"The two of us will find it for
you."
4,1,0,Castaspella,"Glimmer, you're needed in
the Dining Room at once to choose the napkin folding technique! I'm
thinking swans, what do you think?"
4,1,0,Glimmer,Uh...I...
4,1,0,Castaspella,"You're right, it's a
terrible idea. I should just fire myself."
4,1,0,Glimmer,"Aunt Casta, no –"
4,1,0,Castaspella,Mermista! Vases!
4,1,0,Mermista,Don't stifle my creativity!
4,1,0,Castaspella,Uhg. Please.
