season,episode,scene,character,line
1,12,16,Adora,For the honor...of Grayskull!
1,12,16,Adora,"Now, Swifty!"
1,12,16,Swift Wind,Hold on!
1,12,16,Bow,"Guys, look!"
1,12,16,Glimmer,It's not just the woods...it's...
1,12,16,Adora,It's the entire world.
1,12,16,Glimmer,"Bright Moon. Swift Wind, hurry!"
1,12,17,Scorpia,Wow... What do you think it's doing?
1,12,17,Catra,I don't know. But I can work with this.
1,13,0,Adora,"It's coming from the Fright Zone! Whatever's happening, the Horde is causing it!"
1,13,0,Bow,The Whispering Woods are freezing over! What'll we do?
1,13,0,Glimmer,We have to get home! We have to make sure everyone at Bright Moon is okay.
1,13,0,Scorpia,Catra! You've gotta see this!
1,13,0,Scorpia,"Tidal waves, Fire Storms, Earthquakes.. maaaan, Etheria's really taking this hard. I mean-- Yay for us but also woe."
1,13,0,Entrapta,"The experiment has been more effective than I could ever have dreamed, this proves my hypothesis correct! With the Black Garnet functioning at two hundred percent power the precarious equilibrium that governs all of Etheria's natural functions has been thrown into complete chaos! No doubt as a result of the other elemental runestones-- ey!"
1,13,0,Catra,Translate.
1,13,0,Entrapta,"By making the Black Garnet more powerful, we've sapped power from the other princesses Runestones, upsetting the balance and making the weather go screwy. It's all in my notes if you'd like to--"
1,13,0,Catra,Woa woa woa woa wait! What was that you just said about making the other princesses less powerful?
1,13,0,Entrapta,"Well the Elemental princesses, that is. You don't have to worry about me and Scorpia. I don't have a runestone and Scorpia doesn't appear to have any connection to the Black Garnet anymore-- if she ever did."
1,13,0,Scorpia,Huh? Somebody say my name?
1,13,0,Catra,And how would we make an effect like that... Permanent?
1,13,0,Entrapta,"Well, I'd have to run more tests to know for sure but--"
1,13,0,Entrapta,"Or yeah, that should work too."
1,13,0,Catra,"Get a strike team together, we're going to Bright Moon."
1,13,0,Scorpia,Bright Moon? Why?
1,13,0,Catra,"Because, we're going to take out Bright Moon's Runestone, and with the Whispering Woods frozen over... there's nothing stopping us."
1,13,1,Bow,Look!
1,13,1,Glimmer,That's Bright Moon! It's the distress beacon.
1,13,1,Swift Wind,Hang on!
1,13,1,Glimmer,Mom! What's going on?
1,13,1,Angella,The elements are out of harmony. The Moonstone is using all its power to counteract the growing cloud of darkness.... but it's not enough. It's taking nearly all my strength just to keep my connection with it.
1,13,1,Adora,That cloud is coming from the Fright Zone
1,13,1,Bow,So what's our plan? We do have a plan.. right? Guys?
1,13,1,Adora,The woods are frozen over. There's nothing left to shield Bright Moon from the Horde. We have to prepare for an attack.
1,13,1,Bow,"our scouts have reported sighting the entire Horde Army in the woods, moving towards us at top speed."
1,13,1,Angella,"We must protect Bright Moon at all costs. If the moonstone is destroyed, there will be nothing left to stop the darkness."
1,13,1,Bow,"Someone must've seen the distress beacon by now, why hasn't anyone come?"
1,13,1,Adora,The Alliance is broken and other princesses have their own kingdoms to protect. No one's coming Bow.
1,13,1,Other,Someone's come!
1,13,1,Bow,Is it the princesses?
1,13,1,Bow,"Oh. Spinnerella and Netossa ha ha, thanks for coming guys..."
1,13,1,Netossa,"You still don't know what we do, do you?"
1,13,1,Bow,Aaaah.. no.
1,13,1,Netossa,"Seriously?! It's in the name, NET- Tossa. NETS, I toss NETS! Okay?"
1,13,1,Other,"Yes darling, you have beautiful nets."
1,13,1,Glimmer,"At least you have powers, which is more than I've got. But it doesn't matter. I don't need magic to fight!"
1,13,1,Angella,"Glimmer, not only are you without your powers but you're still glitching, it's too dangerous."
1,13,1,Glimmer,But mom!
1,13,1,Adora,"Your mom is right Glimmer, I don't want any of you risking yourselves. She-Ra can do this alone. This is what she's for."
1,13,1,Bow,"Adora, not even She-Ra can take on an army of Horde soldiers ALL on her own."
1,13,1,Adora,Than what good is she?
1,13,1,Glimmer,Adora... are you okay?
1,13,1,Adora,Catra will be leading the Horde when they attack. I have to face her. I can't let her hurt anyone else.
1,13,1,Glimmer,What happened to you in that first one's temple?
1,13,1,Adora,"I saw Catra in there. I thought I could get through to her, but all I did was push her farther to the side of evil. Light Hope said that I'd endanger my friends by coming back and she was right. Everything that's happening now is my fault..."
1,13,1,Glimmer,You've got this. And we've got your back.
1,13,1,Glimmer,"Now come on, the Horde will be here soon. We have to be ready."
1,13,1,Glimmer,Welcome to the Bright Moon armory! Well it's not really but I've been sneaking weapons and stashing them in here for months!
1,13,1,Bow,Dibs on arrows!
1,13,1,Adora,Aaaaah... no.
1,13,1,Angella,Glimmer.
1,13,1,Glimmer,Ah ma mom! How'd you know we'd be in here?
1,13,1,Angella,Did you really think I wouldn't notice you were hoarding weapons?
1,13,1,Glimmer,I'm sorry mom. I can't just stand by while my friends and my home are in danger. I have to do this.
1,13,1,Angella,I know.
1,13,1,Glimmer,"Mom I... wait, what?"
1,13,1,Angella,"I've been trying all these years to mold you into someone more like me... but you're too stubborn and hotheaded, and brave.. like your father. This was your father's staff, I think it's time you had it."
1,13,1,Adora,They're here. For the honor of Grayskull!
1,13,1,Bow,We got this. Right?
1,13,1,Adora,Yeah.... Definitely.
1,13,1,Glimmer,They're going to be sorry they ever tried to mess with Bright Moon.
1,13,1,Adora,Defend the Castle.
1,13,1,Glimmer,Adora! She-Ra needs our help.
1,13,1,Angella,Go to her. I'll keep the Moonstone lit in the darkness away from the battlefield as long as I can.
1,13,1,Swift Wind,You heard the Queen For the rebellion!
1,13,1,Catra,Hey Adora.
1,13,1,Adora,Catra Surprised to see me?
1,13,1,Catra,"Not really, I figured it wouldn't be that easy to get rid of you."
1,13,1,Catra,"You know, I'm actually glad you did make it out of there alive.... because now.. I can take you out myself."
1,13,1,Scorpia,Well isn't that nice? You've accessorized! Not that it's going to help you!
1,13,1,Netossa,Boom! Nets!
1,13,1,Catra,Tired already? I thought punching was supposed to be like-- the one thing you're good at.
1,13,1,Adora,And I thought you were supposed to be quicker.
1,13,1,Adora,"Give it up Catra, there's no way you win this."
1,13,1,Catra,I already made it a lot further than anyone thought I would.
1,13,1,Catra,"You on the other hand, you're not looking so good."
1,13,1,Adora,This isn't over!
1,13,1,Catra,OF COURSE it's not over!
1,13,1,Catra,It won't be over until Bright Moon is destroyed and the rebellion falls. It won't be OVER until darkness covers Etheria forever. And it won't be over until I see the looks on your friends' faces when they find out you failed. That you were too WEAK to save them!
1,13,1,Adora,Enough! You've lost Catra.
1,13,1,Catra,You sure about that?
1,13,1,Catra,What? Did you really think this was about you?
1,13,1,Catra,That Runestone is your last defense.... isn't it? HAHAHAHA! Have fun!
1,13,1,Glimmer,NO!
1,13,1,Scorpia,"So where were we? Oh yeah, I  was about to punch you!"
1,13,1,Adora,Where's my shield? {She searches the water]
1,13,1,Bow,uuh ohh.
1,13,1,Scorpia,"Huu, pretty!"
1,13,1,Catra,"Now, it's over."
1,13,1,Swift Wind,Come on!
1,13,1,Glimmer,Oh mom!
1,13,1,Swift Wind,Princess!
1,13,1,Bow,Adora? Adora!
1,13,1,Bow,"Come on, Don't give up yet. Please! We can still fix this, right? Please tell me we can fix this."
1,13,1,Adora,"ah.. I.. I am sorry,"
1,13,1,Bow,"it's okay,"
1,13,1,Sea Hawk,ADVENTURE!
1,13,1,Mermista,Don't do that.
1,13,1,Sea Hawk,Sorry.
1,13,1,Adora,Mermista! Sea Hawk! You Came!
1,13,1,Mermista,"Yeah- sorry it took so long, the sea kiiiinda sucked today."
1,13,1,Catra,"Come on, GET UP!"
1,13,1,Perfuma,I saw the distress beacon are you all okay?
1,13,1,Adora,No!
1,13,1,Frosta,I hope I'm not too late.
1,13,1,Adora,No! You're right on time!
1,13,1,Adora,FOR ETHERIA!
1,13,1,Angella,Glimmer?
1,13,1,Glimmer,MOM!
1,13,1,Angella,Go on. Go get them
1,13,1,Glimmer,YES!
1,13,1,Bow,"Ha Ha, Glimmer! You're sparkling again!"
1,13,1,Glimmer,Yeah! What I miss?
1,13,1,Adora,The Princesses are united! This is how it's supposed to be.
1,13,1,Mermista,What do you say? Ready to finish this?
1,13,1,Perfuma,Thought you'd never ask
1,13,1,Netossa,We're in
1,13,1,Frosta,Let's do this already
1,13,1,Sea Hawk,ADVENTURE!
1,13,1,Bow,"Adora, it's over! Bright Moon is saved."
1,13,1,Glimmer,And the princesses are finally united! We did it!
1,13,1,Mermista,"That is how it's done in the SEA, really good job"
1,13,1,Netossa,GOOD job Girls! ON to the next.
1,13,1,Frosta,Yeah! We did things ToGEther!
1,13,1,Perfuma,Isn't this wonderful! Ha ha!
1,13,1,Angella,Thank you.
1,13,1,Hordak,"Force Captain, it seems your experiment has failed"
1,13,1,Entrapta,"ON THE CONTRARY! The experiment was a huge success, I know more about first one's tech than ever, this is Just the beginning."
1,13,1,Catra,"I got us closer to conquering Bright Moon than anyone ever has, not to mention the Whispering Woods is still in ruins. Etheria is ours for the taking."
1,13,1,Hordak,"Very Well, force captain Catra.... you will have other chances to prove your worth to me... As my second in command."
2,1,0,Perfuma,"Hey, robot face, watch where you step."
2,1,0,Bow,Incoming.
2,1,0,Mermista,Got it.
2,1,0,Perfuma,"Sorry, Frosta."
2,1,0,Mermista,"Wow, flower princesses can't aim."
2,1,0,Perfuma,I'm working on it.
2,1,0,Frosta,Look out!
2,1,0,Glimmer,Got it.
2,1,0,Glimmer,Thanks for dropping in.
2,1,0,Frosta,"Dropping in, because you dropped him from the sky. Good one."
2,1,1,Adora,Woo-hoo!
2,1,1,Catra,"Oh, cute. You can turn your sword into stuff."
2,1,1,Catra,"Hey, Adora."
2,1,1,Catra,"Did you mean to do that? If you did, it's a terrible weapon."
2,1,1,Adora,Is not.
2,1,2,Frosta,How'd you do that?
2,1,2,Frosta,Can you teleport anything you want? Like a cannon? I can make ice cannonballs.
2,1,2,Glimmer,What? No. Just the staff. It was my dad's-- Ugh.
2,1,2,Glimmer,"Actually, I was sort of in the middle of something here. Do you mind?"
2,1,2,Frosta,It's more effective if you hit their core processing unit.
2,1,2,Glimmer,Ugh. I know. I was about to--
2,1,2,Frosta,Hey. There's another one. Let's get it.
2,1,3,Catra,What are you waiting for? You gonna play me a song on that thing?
2,1,3,Catra,I knew you couldn't do it.
2,1,3,Adora,Did you have to make her so mean?
2,1,3,Light Hope,The simulation is designed for total accuracy.
2,1,3,Light Hope,Is the one you call Catra not mean?
2,1,3,Adora,No. She is.
2,1,3,Light Hope,There. There.
2,1,4,Perfuma,The poor woods.
2,1,4,Perfuma,They'll never be able to regrow if the bots keep attacking.
2,1,4,Bow,Hey!
2,1,4,Bow,I was looking at that.
2,1,4,Frosta,You're welcome.
2,1,5,Adora,I've been training for a month and I haven't gotten any better.
2,1,5,Light Hope,"This performance was, in fact, worse."
2,1,5,Light Hope,Please disregard. My human inspiration protocol is still in the beta stage.
2,1,5,Light Hope,Should I smile more?
2,1,5,Adora,"No, no. It's not you."
2,1,5,Adora,"I wanna be the best She-Ra, I wanna protect the planet."
2,1,5,Adora,"But Catra, she's just in my head."
2,1,5,Light Hope,She has access to your mainframe?
2,1,5,Adora,She isn't actually in my head.
2,1,5,Adora,"When you grow up with someone, they know how to push your buttons."
2,1,5,Light Hope,I can relate. I also have buttons.
2,1,5,Light Hope,"You have come a long way, but there is still much to do."
2,1,5,Light Hope,"You must learn to master your emotions, or you are destined to repeat the mistakes of the last She-Ra."
2,1,5,Adora,"No pressure, huh?"
2,1,5,Light Hope,There is quite a bit of pressure.
2,1,5,Light Hope,Was that not clear?
2,1,5,Adora,"Yeah, no, I got it. So much pressure."
2,1,5,Light Hope,Very well. You must learn by doing.
2,1,6,Kyle,"No. Oh, no."
2,1,6,Catra,Who can tell me what Kyle did wrong?
2,1,6,Lonnie,Where do you start?
2,1,6,Catra,She-Ra is too strong to defeat with force alone.
2,1,6,Catra,But she's slow and easily manipulated.
2,1,6,Kyle,Not again.
2,1,6,Catra,Fix this.
2,1,6,Catra,Then go again.
2,1,6,Catra,Huh?
2,1,6,Catra,What is all this junk?
2,1,6,Entrapta,Isn't it wonderful?
2,1,6,Entrapta,The stuff from my castle arrived.
2,1,6,Catra,Yeah. Wonderful. What's the report from the woods?
2,1,6,Entrapta,Oh! I just received a transmission from one of my bots.
2,1,6,Scorpia,"Oh, boy.  Ouch."
2,1,6,Entrapta,"Oh, wow, it just fell apart with one hit there, didn't it.  I could definitely make some improvements."
2,1,6,Scorpia,"Oh-ho, yeah! Game over."
2,1,6,Catra,"It doesn't matter. We'll just send more bots, and more after that.  They'll be so busy defending their precious trees, we'll conquer the planet before they know what's happened."
2,1,6,Entrapta,I have an even better idea.
2,1,7,Glimmer,"You should've seen it. With the Moonstone super-charged, I've been so much more powerful. I took out, like, at least five bots."
2,1,7,Bow,"Just like the day before, and the day before that."
2,1,7,Glimmer,So? What are we supposed to do? Not fight? We have to protect the woods.
2,1,7,Glimmer,The Horde is going to keep taking ground until it regrows.
2,1,7,Bow,"I know, but how long can we keep this up? Did you learn anything from Light Hope?"
2,1,7,Adora,Uh...
2,1,7,Adora,Getting way better at transforming my sword. Look.
2,1,7,Bow,A pitcher.
2,1,7,Bow,That's so useful.
2,1,7,Glimmer,We can picnic once the woods regrow.
2,1,7,Frosta,We should turn it into a dagger.
2,1,7,Frosta,See me take out that bot with daggers?
2,1,7,Glimmer,Where did you come from?
2,1,7,Frosta,I've been here the whole time.
2,1,7,Glimmer,"Well, we have to go. We have an important meeting."
2,1,7,Frosta,"The war council? I'm heading there, too. Better hurry, you're gonna be late."
2,1,7,Bow,Do we have a new addition to the Best Friends Squad?
2,1,7,Glimmer,Shut up. Ugh.
2,1,7,Perfuma,"Sorry, heh, I think that's my chair."
2,1,7,Mermista,"Yeah, don't you find it helpful to shift perspectives sometimes?"
2,1,7,Glimmer,Aunt Casta! You made it.
2,1,7,Castaspella,"I wouldn't miss it, dearest."
2,1,7,Castaspella,The first war room of the new alliance. How exciting.
2,1,7,Angella,Yes.  It's a shame you couldn't be at the battle where the alliance was formed.
2,1,7,Castaspella,I knew you'd bring that up again.
2,1,7,Angella,We have a great deal to discuss.  Everyone.  Please take your seats.
2,1,7,Angella,"Swift Wind, what news do you bring from your scouting in the west?"
2,1,7,Swift Wind,"The Horde has gained more territory in the west.  But with the help of Netossa and Spinnerella, our forces have managed to re-capture Thaymor. Again."
2,1,7,Swift Wind,"Also, why don't I get a chair? If everyone else has a chair, I want a chair."
2,1,7,Angella,A chair. Of course. I will see to it.
2,1,7,Angella,"Commander Glimmer, how goes the situation in the Whispering Woods?"
2,1,7,Glimmer,"I'm happy to report that we are handling bots, and protecting the woods while it regrows.  Which it is doing.  Very.  Slowly."
2,1,7,Perfuma,"Maybe it's time we stop fighting and start healing.  My powers aren't strong enough to regrow the entire woods on my own, but when we princesses worked together in harmony during the battle of Bright Moon, our powers grew.  We should try to recapture that energy.  Maybe we should hold hands and think healing thoughts."
2,1,7,Bow,"If I may, Your Majesty.  We can't go on like this.  We're defeating the bots, but more keep coming.  While we're using our resources to hold our borders, the Horde hasn't had to deploy a single soldier."
2,1,7,Adora,Typical Catra!
2,1,7,Bow,"I've only been able to recover pieces, seeing as we have never not completely demolished one of these things.  But if we could capture a whole bot, I might be able to program a kill switch.  We could wipe them all out without draining our forces."
2,1,7,Angella,"An excellent idea, Bow. This could turn the tide for us.  Glimmer, you will take your patrol out, and capture a bot for Bow to study and carry out his plan."
2,1,7,Frosta,"Commander, I have some ideas to improve our efficiency. First, we should all have code names."
2,1,7,Frosta,I'd like to be Frostbite. And you could be Sparklebomb. Second--
2,1,7,Glimmer,"Oh, uh, Frosta.  I need you toooo . . . stay back and help Spinnerella and Netossa guard the castle!  Great. Thanks!"
2,1,7,Catra,"With the woods frozen and the princesses distracted by the bots, we've been able to gain significant new ground."
2,1,7,Hordak,"You have not disappointed me, Force Captain.  Clearly, I was wise to promote you."
2,1,7,Entrapta,I'm just gonna borrow this.
2,1,7,Entrapta,"Oh, what is that?"
2,1,7,Catra,"Uh, yes. We've kept the princesses distracted, but we could be doing more."
2,1,7,Catra,"We should be working to take them out, once and for all."
2,1,7,Catra,"Isn't that right, Entrapta? Entrapta!"
2,1,7,Entrapta,"Oh, right."
2,1,7,Entrapta,May I introduce Emily's Kid Sister.
2,1,7,Entrapta,"EKS for short. With First Ones tech at its core, this little beauty has enough power to rival a princess."
2,1,7,Hordak,Impressive indeed. And you can make more of these?
2,1,7,Entrapta,"Yes! I mean, no. I mean, I could.  But I only had enough First Ones tech to make four."
2,1,7,Catra,But I know where we can get more.
2,1,7,Glimmer,"Okay. We'll split up to cover the most ground.  Adora, Bow and I will go east. Mermista and Perfuma, you go west.  Swift Wind, cover the sky and tell us when there's a bot nearby."
2,1,7,Bow,"And, remember, we want an intact bot."
2,1,7,Mermista,"What if it's just, like, a little waterlogged?"
2,1,7,Perfuma,And also covered in ferns that secrete corrosive poison?
2,1,7,Frosta,Or what if it's totally smashed by my ice hammer?
2,1,7,Glimmer,Frosta!  You're supposed to be defending the castle with Netossa and Spinnerella.
2,1,7,Frosta,"I know I ignored orders, but, no offense, those orders were wrong.  You need me here."
2,1,7,Glimmer,You can't just run off whenever you want.
2,1,7,Frosta,But I did. And I'm here now. And I'm not going back.
2,1,7,Glimmer,Fine. You can be in Mermista and Perfuma's patrol.
2,1,7,Frosta,I'm going with you.
2,1,7,Glimmer,Don't push your luck.
2,1,7,Bow,"Uh, guys?  That thing is way more advanced than usual."
2,1,7,Glimmer,Where is it going? Why isn't it attacking the woods?
2,1,7,Adora,It's still just a Horde bot. We know how to handle--
2,1,7,Adora,Okay. That's new.
2,1,7,Glimmer,Ha!
2,1,7,Bow,It's learning!
2,1,7,Adora,"Yeah, well, I'm about to teach it something.  For the honor of Grayskull!"
2,1,7,Adora,What?  We'll capture another bot. That one had it coming.
2,1,7,Adora,Yeesh. I'm sorry I destroyed it.
2,1,7,Swift Wind,"Ooh, that's unnatural. Even for a robot."
2,1,7,Glimmer,Frosta! Do you even listen when people tell you things?
2,1,7,Frosta,What?
2,1,7,Glimmer,Get away from that bot!
2,1,7,Frosta,It's the bot you should be worried about!
2,1,7,Glimmer,Frosta!
2,1,7,Perfuma,There you are. We've been looking everywhere for you.
2,1,7,Mermista,Yeah. Everywhere.
2,1,7,Glimmer,"That was incredibly stupid! You could've gotten hurt, or gotten one of us hurt!"
2,1,7,Frosta,I was just trying to help.
2,1,7,Glimmer,"This is serious, not a game. You need to stop getting in our way!"
2,1,7,Glimmer,"Frosta, wait."
2,1,7,Mermista,Ouch.
2,1,7,Bow,"The Horde's new bots are too fast and too smart.  We'll never be able to catch one. I thought I could help, and be the Rebellion's tech master. But that was obviously a dumb idea."
2,1,7,Adora,"It wasn't. You're the only one who came up with a real plan.  Without it, we'd still just be reacting to the bots.  We need to stop letting the Horde manipulate us.  So let's put our heads together and think."
2,1,7,Bow,"Those bots weren't interested in the woods.  And, they only defended themselves long enough to get away."
2,1,7,Mermista,"Well, that means attacking us wasn't their mission."
2,1,7,Swift Wind,And they all ran off in the same direction.
2,1,7,Perfuma,So whatever they're after is that way.
2,1,7,Adora,"The only thing that's in that direction is -- the Beacon.  I know where the bots are going. And I've got an idea for how to stop them.  Frosta, do you think you can--? Where's Frosta?"
2,1,7,Glimmer,I'll go find her.
2,1,7,Frosta,Come to yell at me more? I just wanted to be your friend.
2,1,7,Glimmer,By ignoring us and throwing yourself into danger?
2,1,7,Frosta,Sorry I don't know how to act. I've never had any friends before!
2,1,7,Frosta,I was eight when I took over the throne.  It's kind of hard to make friends when everyone is your sworn subject.
2,1,7,Glimmer,I know how you feel. I didn't have any friends before Bow and Adora.
2,1,7,Frosta,You? Figured everyone would wanna be your friend.
2,1,7,Glimmer,"Yeah, definitely not everyone.  And I'm still learning how to be a good friend, too.  I'm sorry I yelled. It's just -- I guess you remind me of... me.  And I can do some really dangerous stuff sometimes."
2,1,7,Frosta,I remind you of you?
2,1,7,Glimmer,Ugh. And I even sounded like my mom when I yelled at you.  Please don't make me do that again.
2,1,7,Frosta,Deal.  Does that mean we're friends?
2,1,7,Glimmer,Yes.  And we -- I could really use your help.
2,1,7,Frosta,"You want me to come back?! I knew we'd make a great team!  So, should I do ice hammers or daggers? You're right, one of each!!"
2,1,7,Catra,That place has enough First Ones tech inside to power a whole armada of robots forever.
2,1,7,Entrapta,"Ahhh, I want that!"
2,1,7,Frosta,Ice of you to drop in!
2,1,7,Adora,Switch things up. Keep them guessing.
2,1,7,Bow,We just need to capture one. Take the others out.
2,1,7,Scorpia,"One bot down, but three to go!"
2,1,7,Entrapta,"Fight, EKS's, fight!"
2,1,7,Frosta,"Showed you, bot-face!"
2,1,7,Scorpia,"Ooh, he is not recovering from that."
2,1,7,Entrapta,"Ahhhh, I can't look. Tell me what's happening. No, don't."
2,1,7,Adora,Why can't you be what I want you to be?!!!
2,1,7,Adora,Hmm.
2,1,7,Adora,"Hey, Catra."
2,1,7,Scorpia,It's okay. We have two left.
2,1,7,Entrapta,Do you have tooooo?
2,1,7,Adora,"Bow, look! I got one."
2,1,7,Bow,Adora! Get away from it!
2,1,7,Adora,What just happened . . .?
2,1,7,Bow,It looks like the bots can self-destruct.
2,1,7,Adora,Catra.
2,1,7,Bow,We can't let that one self-destruct!
2,1,7,Adora,Everyone together!
2,1,7,Adora,Whoopsies.
2,1,7,Mermista,"You ready, Ice Princess?"
2,1,7,Frosta,Yeah!!
2,1,7,Bow,"Ha, ha!"
2,1,7,Perfuma,Look!
2,1,7,Frosta,Whoaaaa! Did we do that?
2,1,7,Perfuma,"We did, all of us working together!!!"
2,1,7,Mermista,Personal space.
2,1,7,Catra,You look terrible.
2,1,7,Shadow Weaver,"Catra.  It's been so long. I assumed Hordak finally realized what a lazy, worthless creature you are and banished you."
2,1,7,Catra,Just the opposite. Hordak values me.  I've been busy helping the Horde get closer than ever to defeating the Rebellion. His words.
2,1,7,Shadow Weaver,"If you're doing so well, why are you here?  It's Adora, isn't it?"
2,1,7,Catra,"So?! I let her win one.  We're gaining ground, and our armies are growing!  When they're ready to roll out, I will be at the head!!  And you'll be here rotting."
2,1,7,Catra,Thanks. I needed this.
2,1,7,Frosta,"So, we're okay now that the woods are growing back.  Right?"
2,1,7,Adora,"Light Hope says there's still a lot to fix with the planet, but at least it won't be as easy for the Horde to attack us."
2,1,7,Frosta,"Thanks again for saving me, you know, after that bot threw me off the cliff."
2,1,7,Bow,"Uh, okay. I'm talking into this recorder because that's what the best scientist I ever knew did.  I'm not really sure who I'm talking to. Me, I guess.  So, hi, Future Bow.  We're about to open this thing."
2,1,7,Bow,First Ones tech?  But the only one who knew how to use that was--
2,1,7,Bow,"Hold onto your hat, Future Bow. Entrapta's alive . . . And we left her behind."
2,2,1,Catra,The cities forces have all fled. Dryl is ours.
2,2,1,Scorpia,"All right. I mean I guess it, kind of, was already ours since they're Princess is on our side and all, but the banners, they really make it feel official."
2,2,1,Catra,Where are you?
2,2,1,Scorpia,"That is a great question and the answer is ""I do not know"". Yea, this place is some kind of maze."
2,2,1,Catra,There. That's me. Follow it out when you're done. And hurry up we have work to do.
2,2,1,Adora,"Whewh, getting pretty good huh?"
2,2,1,Light Hope,You have shown improvement. But your attack would have been 57% more effective if you had support from your steed. It is time to bring Swift Wind into your training.
2,2,1,Adora,"Um, shouldn't I work on mastering my own abilities first?"
2,2,1,Light Hope,"As She-Ra, your sacred connection with your steed is as important as any of your physical abilities. He is a part of you, your destinies are intertwined."
2,2,1,Swift Wind,"They sure are! Hi, Adora! I've been here a while but there wasn't a good time for me to make my grand entrance, until now."
2,2,1,Light Hope,I requested his presence. The time has come for the two of you to forge your sacred--
2,2,2,Glimmer,"What do you mean? ""Entrapta's alive""?"
2,2,2,Bow,I couldn't figure out how the Horde was making such big technological advances. But it all makes sense now. They must be holding Entrapta prisoner. I found First Ones tech in this bot. This is what Entrapta was experimenting on before she...
2,2,2,Glimmer,Before we left her behind in the Fright Zone.
2,2,2,Bow,We didn't know.
2,2,2,Glimmer,"It doesn't matter. We should have gone back for her. We should've tried. She got captured trying to save us. Well, we're not just leaving her there now. We've got to rescue her."
